{
  "$schema": "https://json-schema.org/draft/2020-12/schema",
  "$id": "https://dex.local/schemas/product-dashboard-initiatives.json",
  "title": "Product dashboard initiatives (ideas / PRD-backed)",
  "description": "schemaVersion 2.4.0: stable initiative ids prd-{slug}; optional designArtifactUrl / designRevision; prdTier / lane are lifecycle — not encoded in id. Optional Product_ideas frontmatter: prdTier, summary.",
  "type": "object",
  "required": ["schemaVersion", "title", "lanes", "initiatives"],
  "properties": {
    "schemaVersion": { "type": "string" },
    "title": { "type": "string" },
    "updated": { "type": "string", "description": "ISO date" },
    "orchestrationNote": { "type": "string" },
    "executiveContext": {
      "type": "string",
      "description": "Optional short bullets or one-liner for Executive view (current focus from steering)."
    },
    "lanes": {
      "type": "array",
      "items": { "type": "string" },
      "description": "Ordered lane ids (left to right). First lane is Idea (backlog)."
    },
    "initiatives": {
      "type": "array",
      "items": {
        "type": "object",
        "required": ["id", "title", "lane"],
        "properties": {
          "id": { "type": "string", "pattern": "^[a-zA-Z0-9._-]+$" },
          "kind": {
            "type": "string",
            "enum": ["feature_idea"],
            "description": "Orchestration applies to feature ideas only, not operational tasks."
          },
          "title": { "type": "string" },
          "summary": {
            "type": "string",
            "description": "Short digest for the card; may come from build template, Product_ideas excerpt, or frontmatter summary."
          },
          "prdStage": {
            "type": "string",
            "enum": ["none", "draft", "spec_ready"],
            "description": "none = Idea/Discovery (no vault PRD in modal); draft = Design WIP; spec_ready = full PRD under 06-Resources/PRDs/. Inferred from lane if omitted."
          },
          "lane": {
            "type": "string",
            "enum": [
              "idea",
              "discovery",
              "design",
              "spec_ready",
              "in_build",
              "test_uat",
              "shipped_live"
            ]
          },
          "prdTier": {
            "type": "string",
            "description": "Stack label: Current / Next / Future / Backlog"
          },
          "priority": {
            "type": "string",
            "description": "e.g. P0–P3"
          },
          "figmaUrl": { "type": "string" },
          "designArtifactUrl": {
            "type": "string",
            "description": "External design file URL (e.g. Paper); may be merged from browser export."
          },
          "designRevision": {
            "type": "string",
            "description": "Design artifact revision or version label."
          },
          "owner": { "type": "string" },
          "horizon": { "type": "string", "description": "Quarter or free-text window" },
          "rag": {
            "type": "string",
            "enum": ["green", "amber", "red"]
          },
          "whatsNext": { "type": "string" },
          "links": {
            "type": "array",
            "items": {
              "type": "object",
              "required": ["label", "href"],
              "properties": {
                "label": { "type": "string" },
                "href": { "type": "string" }
              }
            }
          },
          "contextFile": {
            "type": "string",
            "description": "Vault-relative (06-Resources/...) or legacy path relative to product-dashboard/ (e.g. initiatives/foo.md)."
          },
          "source": {
            "type": "string",
            "description": "Provenance, e.g. PRDs/Current, dashboard"
          },
          "tags": {
            "type": "array",
            "items": { "type": "string" }
          },
          "intakeSource": {
            "type": "string",
            "description": "e.g. customer, market, internal, board"
          },
          "progress": {
            "type": ["integer", "null"],
            "minimum": 0,
            "maximum": 100,
            "description": "Optional numeric progress for Executive view"
          },
          "progressLabel": {
            "type": "string",
            "description": "Qualitative progress if progress number not set"
          },
          "milestones": {
            "type": "array",
            "items": {
              "type": "object",
              "properties": {
                "label": { "type": "string" },
                "date": { "type": "string" },
                "done": { "type": "boolean" }
              }
            }
          },
          "steeringFocus": {
            "type": "boolean",
            "description": "Pin to Executive “current focus” strip"
          },
          "workflowStatus": {
            "type": "string",
            "description": "Optional chip: blocked, ready_for_spec, etc. (PDLC lane remains canonical)"
          },
          "productBrief": {
            "type": "object",
            "description": "Optional structured intake (problem, users, success, …). Browser-only ideas store this in localStorage export as productBriefById[id]; not required in repo initiatives.json.",
            "additionalProperties": { "type": "string" }
          }
        }
      }
    }
  }
}
