{
  "schemaVersion": "2.4.0",
  "title": "Product dashboard — ideas (PRD-backed)",
  "updated": "2026-04-15",
  "lanes": [
    "idea",
    "discovery",
    "design",
    "spec_ready",
    "in_build",
    "test_uat",
    "shipped_live"
  ],
  "orchestrationNote": "Ideas only — not operational tasks. See ORCHESTRATION.md.",
  "executiveContext": "Next stack (priority): (1) WhatsApp integration → (2) AI Assistant → (3) Peer-to-peer chat → (4) Remote App extensions → (5) EWA FloatPays → (6) Forms.",
  "initiatives": [
    {
      "id": "prd-ai_assistant_conversational",
      "kind": "feature_idea",
      "title": "AI Assistant",
      "summary": "AI chatbot overlay for Blue and the WhatsApp experience; evaluate tools such as Tawk.to as a starting point.",
      "lane": "idea",
      "prdStage": "none",
      "prdTier": "Next",
      "priority": "P2",
      "owner": "",
      "horizon": "Post-GA",
      "rag": "amber",
      "whatsNext": "",
      "figmaUrl": "",
      "links": [
        {
          "label": "PRD",
          "href": "06-Resources/PRDs/Future/AI_Assistant_Conversational.md"
        }
      ],
      "contextFile": "06-Resources/Product_ideas/prd-ai_assistant_conversational.md",
      "source": "PRDs/Future",
      "tags": [
        "Next",
        "PRDs/Future"
      ],
      "intakeSource": "",
      "progress": null,
      "progressLabel": "",
      "milestones": [],
      "steeringFocus": false,
      "workflowStatus": "",
      "productBrief": {
        "problem": "AI chatbot overlay for Blue and the WhatsApp experience; evaluate tools such as Tawk.to as a starting point.",
        "targetUsers": "Frontline employees and people managers using Wyzetalk; platform admins as described in linked PRDs.",
        "success": "",
        "constraints": "",
        "uxDiscovery": "",
        "validation": "",
        "dependencies": ""
      }
    },
    {
      "id": "prd-ai_assistant_faq",
      "kind": "feature_idea",
      "title": "AI Assistant FAQ",
      "summary": "PRD in Future/ — prioritise with Future (P3).",
      "lane": "idea",
      "prdStage": "none",
      "prdTier": "Future",
      "priority": "P3",
      "owner": "",
      "horizon": "Exploration",
      "rag": "amber",
      "whatsNext": "",
      "figmaUrl": "",
      "links": [
        {
          "label": "PRD",
          "href": "06-Resources/PRDs/Future/AI_Assistant_FAQ.md"
        }
      ],
      "contextFile": "06-Resources/Product_ideas/prd-ai_assistant_faq.md",
      "source": "PRDs/Future",
      "tags": [
        "Future",
        "PRDs/Future"
      ],
      "intakeSource": "",
      "progress": null,
      "progressLabel": "",
      "milestones": [],
      "steeringFocus": false,
      "workflowStatus": "",
      "productBrief": {
        "problem": "PRD in Future/ — prioritise with Future (P3).",
        "targetUsers": "Frontline employees and people managers using Wyzetalk; platform admins as described in linked PRDs.",
        "success": "",
        "constraints": "",
        "uxDiscovery": "",
        "validation": "",
        "dependencies": ""
      }
    },
    {
      "id": "prd-billing_self_service",
      "kind": "feature_idea",
      "title": "Billing Self Service",
      "summary": "PRD in Future/ — prioritise with Future (P3).",
      "lane": "idea",
      "prdStage": "none",
      "prdTier": "Future",
      "priority": "P3",
      "owner": "",
      "horizon": "Exploration",
      "rag": "amber",
      "whatsNext": "",
      "figmaUrl": "",
      "links": [
        {
          "label": "PRD",
          "href": "06-Resources/PRDs/Future/Billing_Self_Service.md"
        }
      ],
      "contextFile": "06-Resources/Product_ideas/prd-billing_self_service.md",
      "source": "PRDs/Future",
      "tags": [
        "Future",
        "PRDs/Future"
      ],
      "intakeSource": "",
      "progress": null,
      "progressLabel": "",
      "milestones": [],
      "steeringFocus": false,
      "workflowStatus": "",
      "productBrief": {
        "problem": "PRD in Future/ — prioritise with Future (P3).",
        "targetUsers": "Frontline employees and people managers using Wyzetalk; platform admins as described in linked PRDs.",
        "success": "",
        "constraints": "",
        "uxDiscovery": "",
        "validation": "",
        "dependencies": ""
      }
    },
    {
      "id": "prd-content_moderation_mentions_celebrations",
      "kind": "feature_idea",
      "title": "Content Moderation Mentions Celebrations",
      "summary": "PRD in Future/ — prioritise with Future (P3).",
      "lane": "idea",
      "prdStage": "none",
      "prdTier": "Future",
      "priority": "P3",
      "owner": "",
      "horizon": "Exploration",
      "rag": "amber",
      "whatsNext": "",
      "figmaUrl": "",
      "links": [
        {
          "label": "PRD",
          "href": "06-Resources/PRDs/Future/Content_Moderation_Mentions_Celebrations.md"
        }
      ],
      "contextFile": "06-Resources/Product_ideas/prd-content_moderation_mentions_celebrations.md",
      "source": "PRDs/Future",
      "tags": [
        "Future",
        "PRDs/Future"
      ],
      "intakeSource": "",
      "progress": null,
      "progressLabel": "",
      "milestones": [],
      "steeringFocus": false,
      "workflowStatus": "",
      "productBrief": {
        "problem": "PRD in Future/ — prioritise with Future (P3).",
        "targetUsers": "Frontline employees and people managers using Wyzetalk; platform admins as described in linked PRDs.",
        "success": "",
        "constraints": "",
        "uxDiscovery": "",
        "validation": "",
        "dependencies": ""
      }
    },
    {
      "id": "prd-discovery_backlog",
      "kind": "feature_idea",
      "title": "Discovery backlog",
      "summary": "PRD in Future/ — prioritise with Future (P3).",
      "lane": "idea",
      "prdStage": "none",
      "prdTier": "Future",
      "priority": "P3",
      "owner": "",
      "horizon": "Exploration",
      "rag": "amber",
      "whatsNext": "",
      "figmaUrl": "",
      "links": [
        {
          "label": "PRD",
          "href": "06-Resources/PRDs/Future/Discovery_backlog.md"
        }
      ],
      "contextFile": "06-Resources/Product_ideas/prd-discovery_backlog.md",
      "source": "PRDs/Future",
      "tags": [
        "Future",
        "PRDs/Future"
      ],
      "intakeSource": "",
      "progress": null,
      "progressLabel": "",
      "milestones": [],
      "steeringFocus": false,
      "workflowStatus": "",
      "productBrief": {
        "problem": "PRD in Future/ — prioritise with Future (P3).",
        "targetUsers": "Frontline employees and people managers using Wyzetalk; platform admins as described in linked PRDs.",
        "success": "",
        "constraints": "",
        "uxDiscovery": "",
        "validation": "",
        "dependencies": ""
      }
    },
    {
      "id": "prd-employee_chat_and_groups",
      "kind": "feature_idea",
      "title": "Peer-to-Peer Chat",
      "summary": "Group chat and direct peer-to-peer (DM) messaging.",
      "lane": "idea",
      "prdStage": "none",
      "prdTier": "Next",
      "priority": "P3",
      "owner": "",
      "horizon": "Post-GA",
      "rag": "amber",
      "whatsNext": "",
      "figmaUrl": "",
      "links": [
        {
          "label": "PRD",
          "href": "06-Resources/PRDs/Future/Employee_Chat_and_Groups.md"
        }
      ],
      "contextFile": "06-Resources/Product_ideas/prd-employee_chat_and_groups.md",
      "source": "PRDs/Future",
      "tags": [
        "Next",
        "PRDs/Future"
      ],
      "intakeSource": "",
      "progress": null,
      "progressLabel": "",
      "milestones": [],
      "steeringFocus": false,
      "workflowStatus": "",
      "productBrief": {
        "problem": "Group chat and direct peer-to-peer (DM) messaging.",
        "targetUsers": "Frontline employees and people managers using Wyzetalk; platform admins as described in linked PRDs.",
        "success": "",
        "constraints": "",
        "uxDiscovery": "",
        "validation": "",
        "dependencies": ""
      }
    },
    {
      "id": "prd-feed_social_layer",
      "kind": "feature_idea",
      "title": "Feed Social Layer",
      "summary": "PRD in Future/ — prioritise with Future (P3).",
      "lane": "idea",
      "prdStage": "none",
      "prdTier": "Future",
      "priority": "P3",
      "owner": "",
      "horizon": "Exploration",
      "rag": "amber",
      "whatsNext": "",
      "figmaUrl": "",
      "links": [
        {
          "label": "PRD",
          "href": "06-Resources/PRDs/Future/Feed_Social_Layer.md"
        }
      ],
      "contextFile": "06-Resources/Product_ideas/prd-feed_social_layer.md",
      "source": "PRDs/Future",
      "tags": [
        "Future",
        "PRDs/Future"
      ],
      "intakeSource": "",
      "progress": null,
      "progressLabel": "",
      "milestones": [],
      "steeringFocus": false,
      "workflowStatus": "",
      "productBrief": {
        "problem": "PRD in Future/ — prioritise with Future (P3).",
        "targetUsers": "Frontline employees and people managers using Wyzetalk; platform admins as described in linked PRDs.",
        "success": "",
        "constraints": "",
        "uxDiscovery": "",
        "validation": "",
        "dependencies": ""
      }
    },
    {
      "id": "prd-file_manager_governed_attachments",
      "kind": "feature_idea",
      "title": "File Manager Governed Attachments",
      "summary": "PRD in Future/ — prioritise with Future (P3).",
      "lane": "idea",
      "prdStage": "none",
      "prdTier": "Future",
      "priority": "P3",
      "owner": "",
      "horizon": "Exploration",
      "rag": "amber",
      "whatsNext": "",
      "figmaUrl": "",
      "links": [
        {
          "label": "PRD",
          "href": "06-Resources/PRDs/Future/File_Manager_Governed_Attachments.md"
        }
      ],